{
  "as_of": "2026-06-21",
  "mcp_protocol": {
    "tools_list_pagination": "cursor-based, no hard page-size limit; server determines page size",
    "hard_message_size_limit": null,
    "resources": {
      "list_count_cap": null,
      "list_pagination": "cursor-based (resources/list supports pagination)",
      "content_byte_cap": null,
      "context_window_contribution": "injected as plain input-token message content by host on resources/read; NOT counted as tool-definition tokens",
      "notes": "No spec-enforced count or size limit. Cost is incurred at read time, not at list time."
    },
    "prompts": {
      "list_count_cap": null,
      "list_pagination": "cursor-based (prompts/list supports pagination)",
      "size_cap": null,
      "context_window_contribution": "returned messages array injected verbatim as input tokens by host; NOT counted as tool-definition tokens",
      "notes": "No spec-enforced count or size limit. Prompt templates are typically small; embedded resource content can be large."
    },
    "elicitation": {
      "schema_constraint": "flat objects with primitive-only properties (string, number, integer, boolean, enum); nested objects and arrays-of-objects explicitly NOT supported",
      "rate_limit": "clients SHOULD implement rate limiting; no numeric cap in spec",
      "source": "https://modelcontextprotocol.io/specification/2025-06-18/client/elicitation"
    },
    "sampling": {
      "status": "deprecated as of 2026-07-28 draft; new implementations should not adopt",
      "notes": "No token/count limits applied; was a pass-through to host model"
    },
    "notes": "Protocol enforces no hard message-size limit. All count/size ceilings are enforced by the client or model-API layer."
  },
  "clients": {
    "cursor": {
      "max_tools": 40,
      "tool_call_timeout_ms": null,
      "timeout_configurable": false,
      "timeout_notes": "Community reports ~60 s; feature request open; no official value documented",
      "agent_loop_max_turns": null,
      "notes": "Beyond ~40 tools, extras are silently dropped from model view"
    },
    "claude_desktop": {
      "max_tools": 100,
      "tool_call_timeout_ms": 60000,
      "timeout_configurable": false,
      "timeout_notes": "Hardcoded ~60 s; 'timeout' field in claude_desktop_config.json is currently ignored (as of 2026-06)",
      "agent_loop_max_turns": null,
      "agent_loop_notes": "Per-turn tool-use limit exists; triggers 'reached its tool-use limit' message; numeric cap undocumented",
      "sources": [
        "https://github.com/anthropics/claude-code/issues/5221",
        "https://github.com/anthropics/claude-code/issues/22542"
      ]
    },
    "claude_code_cli": {
      "max_tools": null,
      "tool_call_timeout_ms": null,
      "timeout_default_notes": "Default ~28 h; configurable via MCP_TOOL_TIMEOUT env var or per-server 'timeout' field in .mcp.json",
      "timeout_configurable": true,
      "agent_loop_max_turns": "unlimited (SDK default); server-side ~20 tool-call guardrail (pause_turn) as of ~March 2026",
      "sources": [
        "https://github.com/anthropics/claude-code/issues/47076",
        "https://code.claude.com/docs/en/agent-sdk/agent-loop"
      ]
    },
    "vscode_github_copilot": {
      "max_tools": 128,
      "tool_call_timeout_ms": null,
      "timeout_configurable": null,
      "agent_loop_max_turns": null,
      "notes": "128-tool cap applies in Agent mode; tool timeout undocumented"
    },
    "m365_copilot": {
      "max_tools": 10,
      "tool_call_timeout_ms": 45000,
      "timeout_configurable": false,
      "plugin_io_budget_tokens": 4096,
      "agent_loop_max_turns": null,
      "notes": "10 actions per declarative agent; 45 s plugin I/O budget; 4,096-token plugin I/O token budget"
    },
    "chatgpt": {
      "max_tools": 128,
      "tool_call_timeout_ms": null,
      "timeout_configurable": null,
      "agent_loop_max_turns": null,
      "notes": "128-tool budget across all connectors aggregate"
    }
  },
  "sdk_defaults": {
    "mcp_typescript_sdk_v2": {
      "DEFAULT_REQUEST_TIMEOUT_MSEC": 60000,
      "configurable": true,
      "notes": "resetTimeoutOnProgress now defaults to true (parity with Python SDK)",
      "source": "https://ts.sdk.modelcontextprotocol.io/v2/variables/_modelcontextprotocol_server.index.DEFAULT_REQUEST_TIMEOUT_MSEC.html"
    },
    "mcp_python_sdk": {
      "DEFAULT_REQUEST_TIMEOUT_MSEC": null,
      "configurable": true,
      "notes": "No default timeout historically; see python-sdk#1374",
      "source": "https://github.com/modelcontextprotocol/python-sdk/issues/1374"
    },
    "openai_agents_sdk": {
      "max_turns_default": 10,
      "max_turns_disable": "pass max_turns=None",
      "error_on_exceed": "MaxTurnsExceeded",
      "turn_definition": "one LLM invocation; tool executions do not increment counter",
      "source": "https://openai.github.io/openai-agents-python/running_agents/"
    },
    "anthropic_agent_sdk": {
      "max_turns_default": "unlimited",
      "max_budget_usd": "optional cost cap",
      "server_side_guardrail": "~10 iterations / ~20 tool calls (stop_reason=pause_turn); server-enforced, cannot be overridden",
      "error_on_exceed": "error_max_turns (if max_turns set); otherwise pause_turn stop_reason",
      "source": "https://code.claude.com/docs/en/agent-sdk/agent-loop"
    }
  },
  "serving_stack_open_weight": {
    "tool_count_cap": null,
    "binding_limit": "max_model_len / KV-cache — operator-configured; no vendor-fixed number",
    "default_context_pitfall": "vLLM default max-model-len often 16K, which silently truncates tool calls mid-generation",
    "tool_call_timeout": "no built-in timeout; limited by request timeout in serving framework (e.g. vLLM --request-timeout)",
    "agent_loop_max_turns": "framework/SDK dependent; model layer has no cap",
    "notes": "No tool-count cap at model layer. Context window set by --max-model-len. Tool calling requires --tool-call-parser matching the model family."
  },
  "providers": {
    "anthropic": {
      "prompt_cache_max_breakpoints": 4,
      "prompt_cache_lookback_window": 20,
      "prompt_cache_min_tokens": {
        "opus_4x_sonnet_4x_haiku_4_5_plus": 1024,
        "haiku_3x_older": 2048
      },
      "prompt_cache_ttl_options_minutes": [5, 60],
      "prompt_cache_ttl_default_minutes": 5,
      "prompt_cache_ttl_ordering_rule": "longer TTL entries MUST precede shorter TTL entries",
      "tool_defs_count_toward_rate_limit": true,
      "rate_limit_meter": "ITPM (input tokens per minute) — only UNCACHED input tokens count",
      "tool_call_timeout_ms": null,
      "tool_call_timeout_notes": "No model-API level timeout; enforced by client (Claude Desktop ~60 s hardcoded)",
      "schema_micro_limits": {
        "hard_published_limits": "none",
        "compiled_grammar_limit": "400 error when compiled grammar too large (complex schemas with optional params, union types, nested objects)",
        "unsupported_in_strict_output": [
          "recursive schemas",
          "numerical constraints (minimum/maximum)",
          "string length constraints (minLength/maxLength)",
          "complex regex patterns"
        ],
        "compilation_timeout_seconds": 180
      },
      "agent_loop_default_turns": "unlimited (SDK); ~20 tool calls server-side guardrail (pause_turn stop_reason, ~March 2026)",
      "sources": [
        "https://platform.claude.com/docs/en/build-with-claude/prompt-caching",
        "https://platform.claude.com/docs/en/api/rate-limits",
        "https://github.com/anthropics/anthropic-sdk-python/issues/1185",
        "https://code.claude.com/docs/en/agent-sdk/agent-loop"
      ]
    },
    "openai": {
      "prompt_cache_min_tokens": 1024,
      "prompt_cache_granularity_increment_tokens": 128,
      "prompt_cache_ttl": {
        "in_memory": "5-10 min inactivity; max 1 h; available on all models except gpt-5.5 and newer",
        "extended_24h": "up to 24 h; default for gpt-5.5/gpt-5.5-pro and all future models; available for gpt-5.x, gpt-4.1"
      },
      "prompt_cache_cost": "no extra charge",
      "prompt_cache_key_overflow_threshold_rpm": 15,
      "tool_defs_count_toward_rate_limit": true,
      "rate_limit_meter": "TPM (input + output) — cached tokens STILL count toward TPM",
      "schema_micro_limits": {
        "strict_mode_max_total_properties": 100,
        "strict_mode_max_nesting_depth": 5,
        "strict_mode_all_properties_required": true,
        "strict_mode_additional_properties": "must be false",
        "strict_mode_max_enum_values": null,
        "strict_mode_enum_notes": "large enum sets increase latency; no hard cap published",
        "unsupported_keywords_strict": ["oneOf (use anyOf in non-strict schemas)"]
      },
      "agent_loop_default_turns": 10,
      "agent_loop_disable": "max_turns=None",
      "agent_loop_error": "MaxTurnsExceeded",
      "tool_call_timeout_ms": null,
      "sources": [
        "https://developers.openai.com/api/docs/guides/prompt-caching",
        "https://developers.openai.com/api/docs/guides/structured-outputs",
        "https://openai.github.io/openai-agents-python/running_agents/",
        "https://developers.openai.com/api/docs/guides/rate-limits"
      ]
    },
    "google_gemini": {
      "prompt_cache_implicit": {
        "available_models": "Gemini 2.5+ (all GA models)",
        "min_tokens": {
          "gemini_2_0": 2048,
          "gemini_2_5_plus": 2048
        },
        "discount_percent": 90,
        "storage_cost": "none",
        "notes": "Automatic; no code changes; cost savings passed through automatically"
      },
      "prompt_cache_explicit": {
        "min_tokens": {
          "gemini_2_0": 2048,
          "gemini_3_and_3_1": 4096
        },
        "discount_percent": {
          "gemini_2_0": 75,
          "gemini_2_5_plus": 90
        },
        "storage_cost": "charged per token-hour"
      },
      "tool_defs_count_toward_rate_limit": true,